complaint,is_complaint
Pemerintah bekerja menuju pengelolaan limbah yang lebih baik melalui pengembangan infrastruktur daur ulang. 0
Solusi buat genset yang sudah tercemar comberan jalanan? 1
Ini yang terus, nggak lama dia update tong sampah juga nggak, sih? 0
Gak ada cuman ada disiram air keras. Lebih buruk mana? Malaydesh kacukan Jepang ijo. 0
Ewh, so disgusting. Ada sampah banyak, segala berenang di situ. 1
Buat apa pajak dinaikin kalau gaji segitu-gitu aja? Fasilitas umum nggak dibagusin. 1
Mulai dari bijak menggunakan teknologi dengan penggunaan energi minimal sampai digital recycling dan e-waste management untuk mengelola sampah elektronik agar tidak menjadi limbah yang mencemari lingkungan. 0
Kenapa supirnya ambil jalur kanan sih? Kan bisa aja dia ambil jalur kiri terus ditabrakin ke kiri aja, gitu. Gak usah ke kanan nabrakin orang, apalagi sampai ada yang kepental ke jalur arah berlawanan. Kekkk. Kalau udah tahu rem blong, tabrakin ke beton atau hutan aja, anjir. 0
Masih nggak nyangka aja ternyata ini yang dari dulu aku usahain: lingkungan kerja support, partner kerja asik, jadwal kerja teratur (kecuali kalau lembur), dan masih banyak lagi. Alhamdulillah. 0
Gobloknya nggak kalah sama yang mau ngasepin Singapura pakai kebakaran hutan. 1
Bener banget. Tempat suci ya dijauhkan dari sampah. Kalau begini kan sampah dan tempat memohon berkah disetarakan. Edisi mumet, ira genah asal urip dan eksis. 0
Simpel, karena adanya live streaming sih. Dulu fansfar bisa ngapain? Bacain LR, mentok nontonin Ayana ketawa sampai bengek di Ini Talk Show sama nunggu sirkus. Kalau nggak event off-air, itupun nggak sepadet sekarang. 0
Dalam rangka menciptakan lingkungan yang sehat dan sistem sanitasi yang baik, warga binaan Rutan Tanjung Redeb lakukan penyedotan septic tank seluruh kamar hunian. #KumhamSemakinPasti #KumhamPasti #SpeedUpBerprestasi #LapasBerau #RutanBerau 0
Dari pabrik kecil hingga industri besar, sistem RO hydro dirancang untuk memenuhi kebutuhan air bersih dalam jumlah besar dengan kualitas terjamin. Skalabilitas yang fleksibel dapat disesuaikan dengan kebutuhan Anda, baik untuk manufaktur tekstil atau pengolahan makanan. 0
Harusnya ada yang khusus prioritas, ya. Kan ini baru dibahas kalau pemerintah kurang kasih fasilitas untuk orang berkebutuhan khusus. Udah, lu nggak usah tersinggung. Kalau memang pakai fasilitas umum, tapi seenggaknya jadi manusia juga punya empati masing-masing. Untung punya kaki buat naik tangga. 1
Sama-sama dari Busan. Pabrik Busan emang nggak pernah gagal. 0
Bener banget, setuju. Intinya kalau udah gini ya, yang tercemar (itu) fandom dia. 0
Kok masih ada saja, Pak Polisi. Fenomena apa ini? Kok guru dan guru lagi. 0
Buzzer sampah, sampai mati kau menjelekkan Islam. Islam akan makin berjaya karena Islam agama kebenaran. Kasian, setiap hari menjelekkan Islam tapi malah makin banyak masuk Islam. 0
Udahlah, pakai ngomongin pasal lagi. Sedangkan lu aja pas bawa rumor Shua ini ke radio flop mu itu aja bisa masuk ke pencemaran nama baik juga. Jadi, jangan nyari pembelaan dengan pencemaran nama baik juga. 0
Meskipun sama-sama asam, fungsi dan sifat kimia keduanya beda banget. Asam lambung penting buat pencernaan, sedangkan asam urat itu produk limbah metabolisme yang kudu dijaga kadarnya biar nggak berlebihan. Makanya penting buat ngerti perbedaan ini biar bisa ngatur pola makan. 0
Rumah sakit, masjid, fasilitas umum dijadikan tempat markas Islam teroris. Jika diserang, mereka bisa klaim ke PBB. PBB sudah tahu, Islam radikal harus dimusnahkan. 0
Hampir keserempet bus di jalan depan masjid yang terkenal itu. Bener-bener dah, jalan rusak tiap hari, macet terus. Muak aku. Kok bisa gitu nggak punya lahan parkir? Kalau weekend bus luar kota lalu lalang, pada piknik, nyebrang, berkerumun. 1
Mas Pram menyapa warga di kawasan Grogol Selatan, Kebayoran Lama. Dalam pertemuan ini, ia menyampaikan rencana program kerja dan menjawab pertanyaan terkait aspirasi dan kebutuhan masyarakat serta lingkungan setempat. #JakartaMenyala (1)
Jemput makan tahu fa segera dengan air gula melaka, favorit saya. 1
Ayo kita dorong pemimpin yang berkomitmen untuk membangun fasilitas umum yang layak. #SirekapLebihBaik 1
Semua pejabat negara sudah tercemar virus si Mukidi sebagai atasannya, semuanya dibuat mudah tidak diorientasikan pada rakyat dan negara, tetapi demi kepentingan keluarga dan kroni. Menuju Indonesia cemas. 1
Semua orang membentuk sikap dan sifat respon mereka sesuai lingkungan mereka saat masih kecil. Dulu, saya heran sama orang dewasa yang bisa ngebentak orang tua mereka, kok bisa mereka sampai ngebentak gitu. 1
Hahahahaha, apakah ini yang dinamakan takdir? Terima kasih banyak Jihoon untuk sambutannya dan juga karpet merahnya. Tapi ini sengaja digiring ke air kah konsepnya? Hahaha. 1
Bayar seenaknya sendiri, padahal itu uang iuran bakal diputar lagi untuk kebersihan dan gaji satpam. 1
Ciptakan lingkungan yang aman tanpa judi online. #GerakanLawanJudiOnline 1
Yang lebih gak masuk akal, ada polisi di sana tapi membiarkan saja. 1
Praktek kerja lapangan di lapas atau rutan sudah menjadi tempat yang familiar untuk mahasiswa, khususnya mahasiswa Poltekes Surabaya yang mengambil prodi sanitasi, untuk melaksanakan PKL di lapas kelas IIB Ngawi sebelum mereka terjun langsung ke masyarakat. 0
Mau enaknya doang, dikira sampah yang dibuang bisa hilang seketika. 1
Gusy, minyak sawit dan pohon sawit memang pilihan terbaik jika dibandingkan dengan seed oil lainnya. Tapi cara kita memperoleh minyak sawit, yaitu pembukaan lahan dan perusakan hutan, apakah itu tidak perlu dihitung dan dipertimbangkan? 1
Ini pake AI, jelek banget, ga ada seni dan jiwa. Gambar sampah yang bahkan nggak pantes disebut karya seni. Mending komisi ke artist yang punya nilai seni dan jiwa. 0
Assalamualaikum, mohon kepada DLH Bogor melakukan tinjauan dan bimbingan kepada KRL dan bank sampah kami di Ciber, Cicadas, terutama untuk bimbingan tentang cara membakar sampah agar ramah lingkungan. Kami hanya bisa membakar sampah, namun kami sadar bahwa itu tidak efektif ketika masih ada asap yang mencemari lingkungan. Walau lokasi kami agak jauh dari pemukiman, sebenarnya masih ada cara untuk menghindari asap di tungku pembakaran kami. Namun, keterbatasan biaya membuat kami belum bisa mewujudkannya. Kami sangat membutuhkan bantuan dana, alat, dan bimbingan untuk menunjang hal ini. Mohon maaf jika ada kata-kata yang salah atau menyinggung. Terima kasih atas perhatian Anda. 1
Air mata buaya, minta maaf biar nggak dituntut hukum. Kalau masyarakat tidak bereaksi dan peduli, mana mau minta maaf? Urusan anak-anak malah bikin gaduh se-Indonesia. 0
Kilas balik sedikit tentang perjalanan hidup gue dari kecil sampai lulus kuliah, tentunya banyak banget liku-likunya. Jujur gue juga sedikit gemeter buat bikin story tentang gue pribadi, karena jujur air mata gue udah ngalir deras banget. 0
Lebih serunya lagi, event ini juga mengoptimalkan material ramah lingkungan dan karya seni berbasis sumber daya lokal lho. Diselenggarakan di Umbul Besuki dengan mata air jernih dan sawah asri sebagai latar, acara ini juga mendukung kelestarian sumber daya alam. 1
Pak Lutfi ingin membangun fasilitas umum yang ramah disabilitas agar semua warga dapat mengakses ruang publik dengan nyaman. 0
Iyaaa, mau banget! See you ASAP ya Kak, bismillah, banyak-banyak geng Jumat berkah nanti ya, ditunggu kabar happy-nya kita! 0
Udah masuk jalur busway terus kalau berhenti ingak-ingak lihat kenapa macet, kan goblok ya? 0
I am so sorry untuk hutan baru ini Kak. Sebenernya ini hasil komisi, jadi belum pernah gambar hutan untuk personal art. 0
Real bro, orang yang pendiam nggak selalu tenang di semua hal. Kadang dia emosional pada hal yang berkenaan dengan passion-nya. Karena gue dulu juga gitu, waktu kecil di lingkungan sekolah dan guru gue terkenal diem, tapi waktu turnamen bola, gue jadi liar. 0
Tolong berhentikan mobil-mobil monster yang berlalu-lalang di jalan desa Sentul-Curug Bonteng. Sangat mengganggu pengguna jalan lainnya, lagi musim panas debunya, lagi musim hujan jalan licin. Mohon kepada Dinas Lingkungan Hidup, tolong dihentikan, apalagi sekarang limbah-limbah sampah dibuang ke sini. 1
TP of kos la aku jawab, kan udah nama perempuan aku bilang ke la bilas dengan air, kita nggak tahu udah tercemar apa. 0
KKB Papua menyerang pos TNI dan membakar sekolah di Puncak NA. Ini teroris bikin ketakutan masyarakat dengan membakar fasilitas umum. 0
FR tuntut pasal pencemaran nama baik aja, beres. Wkkkakakak. 0
Tak terima dibilang miskin, Ayah Vadel Badjideh tuntut Nikita Mirzani atas pencemaran nama baik. 0
Untuk melatih jiwa, beli trash picker ini dan pergi kutip sampah. 1
Ini awal statement sanggahan Belift waktu bulan Mei juga gitu, kok bilangnya semua yang dibilang MHJ nggak bener dan mau laporin MHJ atas pencemaran nama baik, tapi sampai sekarang mana kok belum diproses juga. 1
Air mata buaya cuk, kaya gitu masih dipercaya. Minimal nangis sambil gonggong. 1
Aku yang lingkungan tempat kerja orang Jepang aja, hah heh hoh ngerti dikit-dikit sih soalnya pernah belajar Jepang lama tapi real lupa pas kesini. 1
Waktu SD baca novel judulnya Nak Maafkan Ibu, Tak Mampu Menyekolahkanmu tentang anak cerdas dari keluarga miskin di daerah yang tercemar pabrik, tapi happy ending si anak akhirnya bisa sekolah di sekolah bagus, dan itu bikin aku mikir, Ah, kalau pintar dan mau berusaha, pasti bisa. 1
Dalam era global, inovasi energi terbarukan jadi keharusan. Syaikhu Ilham Habibie ingin Jabar jadi provinsi yang ramah lingkungan dan maju. #AsihMenang #JabarKuterbang 1
Sakit tapi tak berdarah, pecah ke serempet mobil iring-iringan polisi, padahal udah ke pinggir. 1
Iya anjir, kalau penunggunya begini, lu mau tinggal di hutan nggak sih? 1
Kementerian BUMN harus selesaikan perintah OJK agar susu sebelanga tidak rusak. Kasihan keluarga besar tercemar. 1
Mendes dan Menteri LH sidak dampak pencemaran Sungai Ciujung di Serang. Temukan dua perusahaan pembuang limbah ilegal. 1
Pernah orang nanya ke aku, apakah mungkin Indonesia bisa dibuat seperti ini? Dulu gue dengan sadar jawab, tanya dulu deh, masyarakatnya bakal buang sampah sembarangan nggak, bakal nggak mengeruk sungai di hulu lebih dalam? 1
I believe doktif, just like I believe Jaguar Wright. Kalau mereka bohong, pasti udah dituntut pencemaran nama baik sama banyak pihak. 1
Old money, dulu nggak ada pencemaran ozon tebal, negara sejuk. 1
Masih banyak juga ya kaum koruptor kere, yaitu mereka yang jumawa merebut hak umum bodoh dan merusak fasilitas umum, tidak peduli kepentingan masyarakat. 1
Kenapa Pak Via, Pak dan koalisinya nggak kuatkan saja minimal kembalikan settingan pabrik, kocok ulang seleksi pimpinannya, minimal KBLI ke step awal. Kalau masih kurang, masukin TNIPurnWRWN yang paling berintegritas. #KDEW 1
Jadi kasihan lihat Pak Polisi, kok bisa ditabrak sampai separah itu. 0
Mantap nih kalau benar deforestasi turun dan hutan mangrove direhabilitasi, semoga bisa terus terjaga ya. 1
Mereka yang katanya oknum penguasa sebenarnya pejabat atau maling? Uang tunai ditimbun seperti sampah, tidak berguna, sementara perputaran uang di masyarakat macet dan seret! 0
Mari kita ciptakan lingkungan bersih dari judi online. #GerakanLawanJudiOnline 0
Wah, ada pemain langganan BPJS dan sahabat karib Sanitas tuh. 0
Bagaimana hasil rakyat DKI ini? Hancur lebur! Kau jadi sampah, rakyat Jakarta ini bos! Senggol dong! Kim Plus kalian dan Projo itu dihukum rakyat toh. 0
Madina berbenah lewat penanganan air bersih dan sanitasi. 1
Belum lagi air naik dari sela-sela keramik kalau ternyata tanahnya tidak mampu menyerap air hujan dan kualitas lantainya buruk. Wkwk. 1
Sempat tertunda, tapi ternyata entitas yang diharapkan sudah berpindah kepemilikan dan beralih hati. Tempat yang dulu sering dikunjungi berubah menjadi tempat sampah. Rindu orang-orang telah melupakan kisahnya yang dulu dan beranjak ke tempat lain yang lebih nyaman. 0
Seandainya bisa memilih, siapa tumbal Sanitas Madrid yang cocok, Ra? 0
Belajar dulu buang sampah pada tempatnya, itu yang paling penting. 1
Ada satu buku cerita, orang Arab zaman dulu tanam perempuan hidup-hidup karena mereka merasa anak perempuan pembawa sial. Mereka takut anak perempuan diperkosa ketika besar, ditawan musuh, dan mencemarkan kehormatan. 0
Oh, ternyata mandi air hangat bisa meredakan stres ya. 0
Alur sampah, dialog sampah, kok bisa ya Jerome mau main kayak gituan? Si Salma ini gobloknya luar biasa, bisa diadu kegoblokannya sama Nana Buana. 0
Bulan ini uang mengalir seperti air sungai yang belum tercemar. 1
Babiii, saya belum lulus, tapi nama kampus saya sudah tercemar. 0
LOL, agaknya by the time semua kapal LCS ini siap, semuanya sudah berkarat, terendam air laut itu. 1
Dul, apa arti turun? Dari atas ke bawah yang tidak diketahui bagaimana caranya? Allah, paham tidak, Dul? Rusak akalmu, Dul, karena sudah tercemar paham ahlul kalam. 0
Tadi melihat banyak warga membawa itu di sekitar trotoar Dharmais, Slipi. Pas jadwal radiologi macet, goodie bag bergambar Ridho. 0
Iya, saya tahu, yang saya tanya bidang sukses saja, bukan yang gagal. Kamu bisa masuk bui lewat UU ITE kan? Pencemaran nama baik, sedangkan kalau menyebut hal sukses, pencemarannya di mana? 0
Wkwkwk, karena kamu otak sampah, nonton konten sampah di TikTok, algoritmanya kasih kamu konten sampah terus, sesuai kapasitas otakmu. 0
Bersyukur banget istri saya nggak main TokTok, nggak tercemar sama quotes penghuni kandang. 0
Perlu ada pelajaran bagi si pelapor atas pencemaran nama baik. Laporkan balik saja. 0
Makin tinggi pohon, makin Dinas Lingkungan Hidup bisa dengan enak mengajukan anggaran untuk perapihan pohon peneduh. 1
Tapi-tapi, kalau rencananya mengalihfungsikan hutan jadi sumber pangan, harus kuliah di mana supaya sejalan dengan rencana itu? 1
Banjir bandang menghantam Halmahera Tengah selama empat hari terakhir, meninggalkan dampak serius. Ekosistem pesisir dan laut terancam, sumber air tercemar, semua akibat pembukaan lahan agresif oleh tambang. 1
Silakan log aduan tiada air melalui Help Center di tautan untuk siasatan dan tindakan lanjut. Terima kasih. 0
Tidak punya otak, merusak fasilitas umum! Kalau saya ketemu ada karnaval model begini, saya kempeskan bannya. 0
InsyaAllah, saintifikasi Islam adalah cabang ilmu yang wajib dibentuk mulai sekarang sebagai kontrol tauhidullah agar tidak tercemar virus sains kafir. 0
Serius, pemain timnas Malaysia kok bisa kena siram air keras? Pemain lain kena teror juga? Apa warga Malaysia suka melukai pemain yang mereka tidak suka? Di Indonesia, seburuk apa pun suporter, tidak sampai melukai pemain timnas sendiri. 0
Kagak, saya sepupunya Aang, bisa ngendalikan itu. 0
Wah, ladang duit nih! Penistaan dan pencemaran nama baik di muka umum banyak rentetannya. 0
Lapor polisi saja, biar ceweknya, cowoknya, dan keluarganya masuk penjara. Melanggar hukum semua, mereka memang pergaulan bebas, jadi ini hukumannya. 0
Pencemaran nama baik dan laporan atas laporan palsu. 0
Prajurit TNI selain menjaga keamanan di sekitar pos Bonggol juga membantu membangun rumah warga. 0
Sekalian bahas pencemaran limbah Bengawan Solo, Bib. Dua provinsi terdampak, Jateng dan Jatim. Sumber pencemaran dari Jateng. 1
Perjalanan kali ini entah kenapa aneh. Diam duduk merokok di hutan dan kehujanan, betapa bodohnya aku. Ah, sialan, seonggok tanah bernyawa pun bersimpuh. Siapa aku? 0
Anak saya lain cerita. "Siapa Bu Guru yang suka marah, Dek?" "Tidak ada, kan?" "Emang Bu Guru marah kalau muridnya nakal. Bundanya yang suka marah tuh." Bunda auto keluar asap tidak dari hidung dan telinga? 0
Dirinya yang salah, tapi identitas agamanya yang tercemar. 0
Warna biru saya tercemar jadinya, padahal warna favorit saya. 0
Pencemaran nama baik La Ode Saepudin laporkan ahli waris lahan di Pulau Poto. 0
Noo! Selamatkan Mami Ce sebelum ikut tercemar virus Skibidi. 0
Kayaknya stres atau penyesuaian tempat baru bisa jadi faktor. Saya juga begitu, kalau di tempat baru dan banyak pikiran. Sudah aman, kan, dirimu? 0
Apa Bapak tidak kepikiran untuk keliling mereview fasilitas umum di kota-kota Indonesia, Pak? 0
Kalau di hutan, terserah. Tapi kalau begitu di mobil parkiran umum, itu mengganggu. 0
Ada ayah dan adik saya, jadi saya sangat bersyukur. Setidaknya bebas dari asap rokok saat di rumah. 0
Iya, dia tidak tantrum, tapi suka tempat sepi dan gelap, seperti gudang pabrik. Hahaha. 0
Amsar mengajak pegawai memberikan kontribusi nyata bagi bangsa lewat tugas di Rutan Barru. 0
Bedakan kelakuan Bea Cukai ke rakyat biasa dan pejabat. Masih mau nutup mata? Tag polisi buat apa? Apa yang saya cemarkan? Tanpa saya cemarkan, junjunganmu sudah tercemar. 0
Walau Gunungkidul dan Kulonprogo presentasinya besar, bukan berarti mereka baik-baik saja. Rumah seperti apa yang mereka punya? Apakah sudah layak huni dan punya sanitasi yang baik? 1
Semoga dia dipenjara seperti tuduhannya ke Pak Suryo atas pencemaran nama baik. 0
Iya itu jalan kaga rusak parah sebenernya bingung pas dibongkar ternyata ini alasannya. 0
Program bagus dinas lingkungan bentuk aksi nyata untuk mewujudkan ketahanan iklim dan gaya hidup rendah. 1
Joe demensia pikir Amerika hutan rimba dan tak punya hukumdasar tua goblok. 0
Neguk apple vinegar langsung dari botolnya yang gede ga diencerin air. 0
Makasih Bandung udah gak hujan dan macet hari ini jadi aku dan Abe bisa kesana kesini super duper happy hari ini ditutup dengan segelas matcha dan thai tea yang seperti dejek vs bonek. 0
Dimana nih tiati kak jaga sanitasi biar nggak ada uler. 1
Kawan JM sebagai bentuk program tanggung jawab sosial dan lingkungan TJS yang berkelanjutan PT Jasamarga Transjawa Tol membantu fasilitas pengairan di wilayah Kabupaten Bekasi turut hadir dalam acara Plt Kepala Badan Perencana dan Pembangunan Daerah Bappeda Agus. 1
Jangan telat makan dan minum air putih yang cukup yaa pakai pakaian yang hangat kalau berkegiatan atau bepergian ke luar. 0
Sosok yang dulu selalu membela kebenaran akhirnya tercemar juga miris liatnya. 0
Tiba-tiba on air apakah si tau ini akan diperkenalkan pertama kali di on air ini. 0
Di Sedau tempat pariwisata Batu Burung lokasi pas di Batu Burung pandangan menghadap ke arah gunung atau ke arah timur sebagian pohon di gunung telah ditebang dan sangat kelihatan jelas dari pantai apakah dinas lingkungan hidup mengetahuinya tolong diproses dong supaya tidak terjadi tanah longsor itu kan tugas kalian jangan tutup mata dan hati nurani kalian. 1
Masih belum ada solusi untuk pembuangan sampah untuk warga Cimahi area Gandawijaya Kebun Kelapa dan sekitarnya akibatnya masih banyak yang membakar sampah membuat polusi dan tidak nyaman. 1
Goodd morninn lofff kamuu jugaa semangatt hari inii janlup air putihnya yaurr. 0
Sobatrimba lebih dari sekadar kayu dan daun pohon-pohon di hutan adalah entitas kehidupan yang memberikan nafas dan menjaga keseimbangan alam mari kita jaga hutan untuk masa depan yang lestari #Jagahutan #Hutanlestari #Kemenhut #Ditjenphl #Satudataphl #Hutanlestari. 1
Berati oknum bisa dituntut pemerasan pembohongan publik dan pencemaran nama baik dong. 0
Mantap jadi orang Indo catcatnya banyak timbalnya air tanahnya tinggi bakteri ecoli dan banyak barang sehari-hari juga tercemar mikroplastik. 1
Udah langganan disitu macet harus gantian jalannya. 0
Lembaga inilah yang mempunyai kewajiban memelihara dan membersihkan lingkungan hidup namun truk mereka seharusnya diparkir di tempatnya bukan di pinggir jalan. 1
Workshop seminar talkshow dan kegiatan yang inspiratif lainnya akan menghadirkan para ahli dan praktisi untuk berbagi pengetahuan pengalaman dan solusi kreatif dari teknologi canggih hingga pendekatan ramah lingkungan mari kita bersama-sama mencari solusi yang terbaik. 1
Info KPH Wil IV Aceh laporan operasi pengamanan kawasan hutan. 1
Iya nihh ketemuan yuk daripada stalk akun gue kan katanya sampah. 0
Dari dulu nyari domino meme yang hulunya kurang transportasi dan fasilitas umum hilirnya jadi nggak ada hiburan romance yang epik wkwk. 0
Sohibul iman masalah sanitasi Jakarta harus segera dibenahi #JakartaAman #TerusBergerakMelayaniRakyat #Nasdi. 1
First time aku jejak kaki sini lepastu tak rasa nak jejak dah sebab pencemaran pemandangan dengan kanvas merata untuk buat kedai diorang. 1
Hari ini kedatangan tamu seorang perempuan yang mengadukan bahwa suami siri telah berbuat KDRT dari penelantaran anak sampai nafkah ekonomi tidak dicukupi bahwa membuat suami siri melakukan tindakan pidana pencemaran nama baik sehingga yang bersangkutan akan membuat LP. 0
Rakyat mana yang makmur keadilan apa yang Anda maksud SDM mereka dikeruk tapi mereka dipinggirkan lingkungan mereka tercemar jadi saya tidak mengerti keadilan mana yang dimaksud. 1
Udara di kota-kota besar semakin tercemar pentingnya kita semua untuk berkontribusi menjaga alam. 1
Dipikir-pikir cobaan gw berat juga gw jadi public enemy di lingkungan tempat tinggal gw karena dituduh cewek nggak bener hamil duluan benerin rumah sendiri dibilangnya ngambil tanah orang nggak kuat sih sebenernya makanya kalau punya uang semoga aja bisa punya apart. 0
Semoga oten pesek kepanasan trus langsung pada berangkat lah ke Israhell daripada cuma jadi sampah doang disini. 0
Betul sebelumnya ada LSD lahan sawah dilindungi tapi oleh pengembang besar nggak ngaruh semua digusur lalu hutan buat sawah baru. 1
Pajak lebih tinggi daripada Jepang akan tetapi kontras dengan Jepang pemerintah RI sama sekali tidak becus dalam hal menyediakan fasilitas kesehatan pendidikan kendaraan umum keamanan keselamatan dari bencana alam saluran air minum dan makanan yang jelas kandungan gizinya. 0
Emang mantepnya Angela tuh main di hutan nder pegang retri. 0
Mahasiswa Manokwari tolak program transmigrasi mengancam lingkungan dan hak masyarakat adat. 1
Jikalau Capres BEM FIB nggak ada ide untuk mengajarkan mahasiswa FIB membuang sampah dengan benar dan menutup pintu dengan benar nggak usah pilih lah orang nggak ada perubahan samsek donk. 1
Dari banyaknya lamaran yang gue taruh seenggaknya ada satu yang nyantol deh jangan sampai gue nekat kerja di pabrik. 0
Khususnya terkait peningkatan kepatuhan masyarakat kepatuhan pembayaran pajak kendaraan bermotor memiliki dampak langsung terhadap roda pemerintahan daerah khususnya dalam mendukung perbaikan layanan publik dan fasilitas umum ujarnya. 0
Semoga Cilegon bisa menjadi kota yang bersih ke depan masih banyak hal yang perlu dibenahi seperti stock pile di depan perumahan TCI yang debunya tentunya akan sangat berbahaya bagi penghuni perumahan tersebut. 1
Tadi pergi pasar orang dok niaga jerit mangga susu bergetar apa ke sampah lah tagline Melayu meniaga. 0
Salah satu perangkat daerah di Kabupaten Indramayu yang membantu tugas Bupati dalam bidang lingkungan hidup terletak di lokasi strategis di Kota Indramayu dekat alun-alun taman kuliner Indramayu. 1
Setelah pertemuan keluarga jangankan perteman persaudaraan aja najis akhirnya perceraian disuruh adiknya udah kak cerai aja ngapain kak nikah sama orang enggak punya nama keluarga saya tercemar akibat keributan di rumah saya apa masalahmu Mr. Wick pernikahannya mau b. 0
Yang gue takutin member TXT juga ikut tercemar njir apalagi sesama Bighit. 0
Kata siapa politik sama bola dipisah hah ni buktinya tim sampah macam Macabi bisa main di Eropa dan nggak main di tempat tuan rumah Besiktas. 0
Sebenarnya dari segi hukum polisi tau diri itu pelanggaran ranah wilayah pendidikan sampai berlarut gini guru dan PGRI bila perlu tuntut balik polisi ortu siswa pasal pidana dan perdata pencemaran nama baik atau tuduhan yang merugikan polisi jangan berpihak PGRI gugat balik. 0
Kwkwkwkwk mungkin kamu harus pindah lingkungan Dutttt. 0
Mbamas joki tugas ada yang bisa ngitung debit timbulan air limbah domestik pake Excel dan jadi hari ini kah rep kalau ada tolong. 0
Pengen jadi explorer bruh keliling hutan Indo buat identifikasi tumbuhan tu seru banget. 0
Kasihan Pak PS nama baiknya bisa tercemar saya yakin ini bukan keinginan Pak PS. 0
Merokok saja itu sudah bodoh apalagi merokok saat berkendara itu jauh lebih bodoh wkwkwkw belum ketambahan yang mer
yg utama kan belom naga air di md naga api di xd eng hian drmn ya ws
Unifi apa zu ak unifi air payah betul la line jiran ak fibre elok ada haha tapi rumah mak ak di Tapah fibre boleh kata tiap minggu problem, 0
Tapi tak tercemar dengan kehadiran para buzzer yang mikirnya jungkir balik, gak bisa bandingin juga, gak pernah tertarik install app TikTok, 0
Jatam soal nikel, Weda Bay bikin sungai tercemar dan wabah ISPA, 1
Iya, vendor air galon mereka buat bikin minuman pun bukan air keran sendiri, harusnya makanya kalau si vendor es sumbernya sama kayak vendor air minum ya sama-sama tercemar, 1
Cari tahu sendiri biar gak disuapin lagi, katanya pengen itu mah gak konyol, benar kok pencemaran. Nama baik juga perlu dijaga, laporin aja ke agensi bukan hukum di sini langsung tepat. Lha kamu anak hukum kok gini sih, bi kecewa ak, 0
Longsor sampah di TPA Burangkeng, akses jalan tertutup, pagar pembatas rusak, 1
Ya gak papa, asal bisa memenuhi ekspektasi di tempat kerjamu. Kalau kerja gak beres, malah kasihan nama orang yang bawa kamu, nanti nama baiknya tercemar karena masukin SDM yang berkualitas rendah ke kantornya, 1
Penderita malaria dan DBD di Morowali meningkat, warga diminta rutin bersihkan sanitasi lingkungan, 1
Laz pozas beneran wangi hutan kah? Ada sweet-nya gak, 0
Tingkatkan kesadaran lingkungan, Pelindo gelar program TJSI Biodiversity Camp, 1
Ditambah Cenblue, sampah yang suka asbun suka ngereply gak sesuai konteks, wkwkk, 0
Ada, kalau di Jogja bahkan ada driver yang emang sengaja cari orderan malam sampe subuh gitu, katanya biar lebih adem dan gak kejebak macet, 0
Maafin diri sendiri karena terlalu silau dengan apa yang orang lain punya, 0
Di Bali kalau nemu jalan tembus yang sepi dan gak macet terus lebih cepat rasanya, lebih bahagia daripada nemu uang, tapi kalau nemu duitnya segepok senang juga sih, 0
Hobi orang tolol suka ngerusak fasilitas umum cuma buat hal yang gak ada manfaatnya sama sekali, 1
