complaint,is_complaint
iyasih kalo banjir inginnya mengumpat pemerintah dan yang suka buang sampah sembarangan kalau gak banjir yaudah pake payung,1
lebih baik fokus ke lebih bermanfaat aja min buat apa bahas sesuatu yang sampah miris memang faktualnya orang orang yang tak punya adab semoga jempol kita dijauhkan dari hal tidak berguna,0
waktu masih bocah tahu kan paling suka kalo hujan kita main air hujan hujanan nah dulu tuh rumah masih jarang yang di halaman rumahnya di semen semua main air hujan sambil sepedaan di halaman orang yang udah di plur di semen jatoh pingsan ber jam jam pokok udah di datengin,0
mana pas make keseringan kena macet jelas ga dapat feeling pleasurenya nyetir,0
pesan moral kamu boleh menjahili bawahanmu jika kamu adalah kaisar tapi ingat jangan ambil aset milik bawahanmu dia bisa membuat namamu dan keluargamu tercemar lewat karyanya,0
aku tinggal di kota ini tapi disini gak desa kok ini masih kota fasilitas kota nya lengkap transport umum juga bagus apalagi tempat wisatanya banyak,1
bro menhutan mangrove di bali semakin hancur siapa yang harus awasin bro,1
kemudian pengelolaan lingkungan jadi buruk kalau dikuasai koruptor mau merawat dan menata lingkungan ga ada dananya lahan sungai dan laut jadi berantakan karena pencemaran dan sampah serta eksploitasi berlebihan kita mau mancing jadi sulit ikannya kan penderitaan itu namanya,1
karna negara eropa udah maju ratusan tahun bukan negara maju baru macam china jepang south korea,0
sorry to say ini pemikiran bodoh kenapa polusi jadi turun langit cerah cuaca adem tumbuhan dapet air jadi bisa tumbuh and masih banyak lagi contoh nya,0
jangan menyerah menyadarkan lingkungan sekitar kita walaupun capek tapi tetep jangan nyerah,1
when bapak ngabarin bahwa kalau beliau njemput gua bahkan nungguin pas langit lagi panas panasnya sumpah ga boong begitu sampe kamar gua langsung mandi saking gerahnya dan saat itu beliau bawanya motor bukan mobil katane biar sat set ga kena macet,0
dari pembangunan fasilitas umum pelatihan pelatihan sampe bantuan sosial semuanya kerasa manfaatnya buat masyarakat,1
nih klo gue dikenalin sama tetangga gue bjirlahh gue ga bisa pake celana daster keluar rumah kek buang sampah aja harus cakep kali yaa,0
bagussss jangan gila nya ama rendi deh ge rendi ga worth it ditangisin,0
jir emang loe tinggal di jepang lu mau cari kerja apa disana freelancer adanya jadi buruh kaya petani ato kerja pabrik,0
gaada terpaksa terpaksanya apa apa juga diusahain disanggupin kan lupa teh bilang ini itu ini itu emang gabisa aja segala bilang terpaksa ini itu terpaksa pura pura ke sampah ini doang yang dijadiin mainan doang udah ga guna dibuang ya rugiin lagi hehe,0
ditambah air dikit soalnya klo gak ada airnya nanti gosong,0
baru beres sholat subuh mataku dah tercemar melihat sg eajpark itu,0
kita butuh perubahan hukum yang beneran nendang biar lingkungan kita bisa terlindungi dengan baik,1
infrastruktur bikin jalan jembatan listrik sampe fasilitas umum buat bantu aktivitas sehari hari warga lokal,0
kamu pikir kamu kaya punya segalanya lalu menganggap orang lain sampah angkuhmu membunuhmu belajarlah dari rafael alun,0
ya allah puji tuhan terimakasih tuhan yesus sejak yang bersangkutan dijadikan doktor aku ngerasa ijazah ui ku sampah banget ga ada artinya integritas akademiknya luntur seketika sekarang alhamdulilah merasa nyawa itu dikembalikan,0
ugm kena sebenarnya semua situs resmi institusi pendidikan udah tercemar dengan backlink ke situs judol di data dibawah contoh dari analisis semua iya semua orgorg yg kerja di situs gacor jago banget buat nyusupin backlink buat naikin traffic,0
rumah mepet hutan mah gini serangganya ga cuma nyamuk doang segala kumbang badak juga ada,0
efek buang sampah sembarangan kalo yang dilaut biasanya yang suka mancing tuh,0
fasilitas umum yang cukup ramai ditakutkan nantinya jika peserta terlalu banyak akan mengganggu masyarakat lainnya yang sedang menikmati farsum tersebut,0
wiii kemungkinan pabrik yang sama kayak ibunya brrti ya mantap ini dcc kerjasamanya,0
pendukungnya sampah semua gitu ya terus bilangnya ya kalo ga sependapat sama lo bebas lah bedain berpendapat berargumen sama ngatain orang aja gabisa kok ya,0
udara di indonesia semakin tercemar mari kita kurangi penggunaan kendaraan bermotor,1
sudut lebar bidikan statis hutan bambu yang tenang di sichuan tiongkok seekor panda raksasa sedang mengunyah bambu dengan malas kamera menangkap panda dari sudut rendah menekankan ukurannya dan tanaman hijau subur di sekitarnya,0
sudah biasa di daerah situ bukan hanya spion hp juga sering jangankan di tomang di senayan depan hotel century aja pernah kok alphard dicongkel spionnya padahal kondisi sedang macet dan rame,0
akhirnya saya bertemu dengan dia di hutan kalimantan selatan dan berhasil memotretnya,0
review yang pernah milih proyek mkwk sanitasi dan air bersih dong,0
saya sih yakin yang komen sampah buzzer mereka kerja apa aja mau,0
dengan fasilitas modern bandara ini siap menyambut penerbangan umum dan mendukung mobilitas di ikn kalian udah siap terbang dari ikn share pendapat kalian di bawah,0
nyampe rumah juga motor ku mogok jirr serem banget mana mogok nya di tempat yg aksnwidhuh kiri ada kali kanan kayak pembatas pager pabrik gituuu untung jalanan nya ga sepi banyak orang lewat,0
pencemaran jenis baru deretan billboard gambar politisi,0
misi called remind pasal appointment next week lepas tu bagi tau result lepas minum air gula ritu alhamdulillah x sangkut,0
lingkungan toxic gua pasti bye sih karna ngerasain betapa capeknya jasmani dan rohani di lingkungan toxic kalo ada pilihan c mending ca atau ya b aja lah,0
jobdesk gue di lingkungan pertemanan ini sangat beragam ya,0
lu ngomong gini kayak transumnya merata dan jalan umumnya bagus aja wkwkw udah narikin pajak sebanyak itu bukannya bagusin fasilitas umum malah cuma buat foya foya pejabat aja goblok mikir geh kalau punya otak kalau gak punya gapapa maklum lu goblok soalnya,1
wkwkwkwkw banyak macam sih jokes nya pungut dari tong sampah ketukar sama anak orang lain anak angkat tapi yang tong sampah paling legend,0
namanya jalan tol jalan bebas hambatan tapi tetap macet dan wajib bayar juga kalo macet hadehh,1
bacot goblog urusin tuh pemain lo yang kena siram air keras soalan serius,0
alhamdulilah hari ini gak macet tp tenggorokan sakit,0
padahal dengan perubahan sikap dia dan membuang saya seperti sampah itu seharusnya bisa menjadi jawabannya,0
karna kalo lo masih manusia dan disekolahin harusnya lo bisa mikir tentang sustainability impact sebab akibat doesnt matter lo beragama atau tidak minimal punya otak yang cukup untuk melihat bahwa fasilitas umum adalah untuk kepentingan bersama dan ewitwut itu cuma kepentingan lo berdua,0
duh dia mau kabur aja buruan dirantai eh diborgol pak polisi bahaya kalau kabur,0
peduli dengan saya karena takut tercemar ketoxican itu ya,0
ada tugas diskusi pencemaran nama baik pakai contoh yang lagi gempar akhir akhir ini aja dah si agensi kuning itu,0
bri peduli hadirkan program jaga sungai jaga kehidupan untuk bersihkan sungai tercemar bripeduli jagasungaijagakehidupan briliandancemerlang qrisbri,0
lucunya kenapa banjir tapi yang disalahin hujannya padahal mah alesan banjir kan karena kurang drainase tanah penyumbatan saluran karena sampah dan lain lain itu karena ulah manusia kocak bukan karena hujannya,1
ternyata pertalian darah itu segitu aja ternyata segitu doang cara pandangnya sejijik itu kalian sama saya kayaknya emang harus pamit sih makasih buat semuanya anggep aja saya udah gaada toh kalian udah anggap saya sampah happy ya kalian semua dari sampah yang kalian buang,0
sekarang kayaknya memang paling enak blok blok kalau ada yang gak sesuai sama mataku untuk menghindari pencemaran timeline,0
itu si suaminya raynel yah asli si khamut sih hutan lindung yah,0
kalian sebaiknya tinggal dihutan apa digoa eneg ane lihat kalian gede bacot punya legal standing enggak tapi sok kek pejabat dan orang penting yang namanya tercemar alias pencemaran nama baik padahal kalian tu siapa,0
tolong diurus dong pegawai yang koruptif maen ada masyarakat komplain banyak pemungut dan pembakar sampah ilegal yang ketika kami protes ke dlh nya pegawainya malah nawarin pemungut sampah dari dia ketika kami tanya ke pemungut sampah di sekitar kami kenapa gak kerja sama dlh jawabannha punglinya terlalu besar jadi gak untung tolong dong diurus tangsel ini polusi tertinggi di indonesia disebabkan oknum bakar sampah sembarangan masa gak malu,1
bappeda kota gorontalo bahas persampahan air bersih dan sanitasi di forum cric,0
gw ngebayangin set perform xg kayak lagi di hutan terus mereka pake kostum wolf kayak yang di foto konsep,0
kemudian adapun dampak jika adanya pembangunan rumah makan atau warkop disekitar rumah sakit yaitu sangat berbahaya dikarenakan limbah yang sangat berbahaya yaitu limbah rumah sakit jadi otomatis air yang disekitar rumah sakit akan mudah tercemar,1
jika sebuah pohon tumbang di tengah hutan dan tidak ada yang mendengarnya apakah tetap menghasilkan suara,0
pentingnya berteman dalam lingkungan yang baik dan positif min,0
hati hati ya jangan buang limbah obat sembarangan itu bahaya banget buat makhluk hidup,1
di kata katain lo min jerat dengan pasal penghinaan pencemaran nama baik dan perbuatan tidak menyenangkan kena tu,0
gausah di cemarin udah tercemar dari ketikan lu keliatan ga teredukasi,0
oppa mengapa x ku tidak bisa kirim emoji ya padahal aku sudah membersihkan semua sampah di hp pernahkah kamu mengalami ini,0
kalo aturan di us apabila orang kaya ingin persentase pajak pendapatannya menurun harus membuat yayasan sosial atau membangun fasilitas umum,0
tapi kalo di hutan adanya cimol isi rumput kamu tetep suka,0
mau dihantam jalan rusak pun ban belakang motor ini rewel sedangkan ban motor depan ku ini aman aja,0
wajib proses hukum orang tersebut sudah merusak fasilitas umum yang dibiayai dari uang pajak rakyat,1
waktu menjabat statemen dia juga menyakiti hati rakyat sudah tidak menjabat kembali ke setelan pabrik udah kek hp aja dia ya babeh,0
di lingkungan gue ada yang begini dan cerita ga enak banget ga megang duit belanja mau beli bakso aja harus minta mertua wkwk kayak main adek kakak anj gitu mah untung dia punya skill jadi skillnya dipakek nyari uang buat pegangan dia,0
ditambahkan untuk memaksimalkan pelayanan sangat penting juga sanitasi di rutan klungkung agar menjadi perhatian agar tetap lancar dan bersih supaya tidak menimbulkan peluang adanya penyakit ketika rutan bersih maka warganya pun akan sehat itu akan memudahkan tugas kita,0
butuh au angsat yang nguras air mata ayok yang punya kasih aku rekomendasi siapapun kapalnya,0
guysss siapa tau jastip ticket yang trusted pleaseee needed asap,0
nah ini sebasic ngantri aja susah banget mending ginian aja dibenerin dulu buang sampah juga masih seenaknya bahkan sering ketemu orang buang sampah dari dalem mobil pas lagi jalan huh,0
this i would want a kid kalo punya suami dan mertua yang membantu terus lingkungan juga mendukung kalo ngurus sendiri mah beban anjeng kasian anaknya,0
terus kalo ngomongin akun sebenernya akun twitter ini dibuat untuk happy things only tapi mulai tercemar sama tweet marah marah ke pemerentah,0
bahkan pernah tidak ada satupun pembeli yang membeli dagangan ibu sehingga mereka berdua harus memutar otak untuk membeli keperluan keluarga dengan gaji buruh tani bapak yang tidak seberapa dengan adanya aku yang bekerja di pabrik hidup ibu dan bapak sedikit terbantu dengan,0
peringatan survei tentang proyek raksasa di papua tampaknya diabaikan pemerintah disebut tidak merespons kepentingan masyarakat adat dan dampak negatif dari proyek konversi lahan menjadi perkebunan papua lingkungan,1
waduhhh twitter dah tercemar dengan pick me girls la,0
dinas lingkungan hidup kabupaten bantul bekerjasama dengan jpsm amor bantul dalam penanganan persampahan dan lingkungan sosialisasi program kampung hijau rakerda jpsm dan lain lain,0
waspada hoax dan hate speach polres luwu timur menghimbau kepada masyarakat untuk mewujudkan pilkada aman damai dan sejuk dengan bijak menggunakan media sosial karena ada ancaman pidana jika menyeberkan hoax hate speach dan pencemaran nama baik melalui media elektronik,0
stop ehh lagi ikhwn tuu lalu kat fyp aku aku ni dah terikut sikit sikit pasar ikhwn di putrajaya rasa otak tercemar,0
buat kalimat terakhir gue setuju banget tapi langkah hukum apa emang yang bisa persija ambil pencemaran nama baik keknya engga deh atau ada yang lain,0
kamu tau ngga kalau bikini bottom itu sebenarnya bagian laut yang tercemar limbah baru tau sama saya juga barusan liat google tentang fakta mengenai bikini bottom,0
semoga semakin banyak yang peduli sama lingkungan dan masyarakat adat ya,1
tidak semua fans indonesia itu paham bola sebagian besar paham bola beberapa cuma pengen liat pemain doang dan sisa nya adalah sampah,0
lu yang sampah padahal yang komen tolol itu kebanyakan cowok ngapain lu salahin cewe mulu,0
mantap nih tindakan kementerian lingkungan hidup harusnya udah dari dulu disegel biar lingkungan kita aman,1
hati hati diserang balik nanti keluar nih kartu minoritas sampah,0
kasus pembunuhan itu tidak perlu dilaporkan polisi harus bertindak beda dengan kasus pencemaran nama baik ataupun penganiayaan,0
ajak ketemu aja min sayang energi buat layani orang kayak gitu sampah,0
berasa penting ya opini lu urus noh sbf shipper tercemar lo yang namanya jelek sampe ke fandom luar,0
mahasiswa isinya anak abah semua sudah tercemar kasihan,0
razman nasution resmi ditetapkan jadi tersangka dalam kasus pencemaran nama baik hotman paris meski begitu razman tetap optimis dirinya nggak bakal ditahan detikhot,0
membayangkan malam yang baru baru ini kami habiskan di hutan membuat aku mengingat lagi bagaimana sikap barbarian yang sebastian maksud kurasakan sendiri dari cara benjamin mendorongku ke salah satu batang pohon cont,0
lanjuuuuut bang jhon sampah wajib disingkirkan dari nkri,0
asap tipis terkadang membumbung seolah memberi tanda bersiaplah aku mungkin akan bangkit tetapi di balik ancaman ada kekuatan yang luar biasa lewotobi tetap mempesona meski dalam ketegangan melalui letusan yang lembut dan ancaman yang tak pasti,0
setiap liat grup sound ini banyak merusak fasilitas umum lainnya mau melihat negaranya maju tapi pola pikirnya hadeeeh tolol,1
agak berlebihan memang dan bermaksud buat efek jera tapi masih banyak cara contoh bawa aja ke kantor polisi pura pura bikin laporan terus masukin ke sel beberapa jam biar ngerasain,0
wkwkwkwk nih hasil air keran kantin di ui yang warna merah keunguan itu coliform yang berarti air terindikasi tercemar feses di ui pemenuhan kebutuhan airnya kerjasama sama pdam depok,1
agus salim bersama pengacaranya farhat abbas mengaku kecewe dengan perbuatan novi yang seolah menyudutkan agus salim dan keluarga farhat abbas bahkan mengatakan telah melaporkan novi atas dugaan pencemaran nama baik agussalim novipratiwi farhatabbas dennysumargo,0
iya padahal banyak banget pabrik yang butuh jurusan ini emang fix bloon anaknya,0
ga mau ikutan bahas drama sih tapi ya emang gila nyari pamor sampe segitunya kena pasal pencemaran nama baik ga sh kalo di normies,0
mantap nih kang acep punya visi yang bagus banget pengelolaan lingkungan kota kita bisa jadi panutan buat yang lain,1
hu hu hu jadi melayang ke masa lalu saat pulang sekolah sepatu ditenteng buku dilipat dikantong belakang pulang sekolah menyusuri ank sungai hingga ujung jembatan berakhir mandi dan loncat ke sungai yang airnya jernih berkilau sekarang sungainya kotor dan banyak sampah,1
ayoooo teh novi segera laporin pencemaran nama baikkkkkkk,0
babilah berak tak flush jijik nak mampos tercemar mata aku,0
anda serius ngomong gini anda ga pernah baca banyak berita wartawan dilaporkan pencemaran nama baik sama tersangka kasus tipikor anda hidup di goa apa gimana,0
eh ada zine ikan air tawar karya popiumworks juga aku juga demen zine ini highly recommended,0
mees hilgers sampe harus minta maaf karna sdm rendah dan sampah,0
malaysia negara bunian pun dalam senarai helooooo korea xda pun dalam senarai dasar otak bodoh makan sampah,0
buat hilang mood orang je kan patut kurung dia dalam bilik air duk diam situ sampai habis majlis,0
eh manusia goblog bisa bedain fasilitas umum ngga gue heran sama yang modelan begini suka menutup akses jalan tapi kalau agama sebelah yang dirumah hebohnya sekampung,1
akun sampah sedeng bekerja meski tolol yang penting menghasilakan,0
ya ampun hashtag sandyourheart tercemar padahal udah srekk banget sama hashtag ini adohhh,0
anggota polsek kutasari melaksanakan patroli malam untuk memberikan himbauan agar selalu menjaga keamanan lingkungan,0
sudah saatnya krl ada fasilitas toilet umum soalnya betul kadang suka tiba tiba pengen pipis,0
tendou maya ak kalo dari korea nggak ding mayasama tida perna telihat insecure tapi yeongseo ini si hutan hujan yang sangat teduh nan hijau banget,0
salah satu instansi pemerintah yang sangat ramah pelayanannya baik dan memuaskan sangat kompak tetap jaya,0
stop masuk mentab gua tercemar mentabku yang suci ini,0
pernah sikseksok pas pindah ke lingkungan yang toa mesjidnya selalu rame di sisi lain aku teh lahir dan besar di lingkungan yang penerapan agamanya baik,0
kelompok pemuda di madiun membuat resah warga aksi lempar batu antar pemuda mengakibatkan sejumlah rumah warga di jalan rawa bakti rusak warga berharap polisi segera menangani kasus ini untuk mencegah kejadian serupa madiun kriminal jawatimur portaljtvcom theportaljtv,0
nu lagiyah ormas sudah tercemar yahudi semakin bebas jadi juru bicara yahudigus jewish,0
saya gak setuju anak anak kita gak butuh koding koding dimasa beliau kek gitu mereka itu butuh nya etika dan tata krama contoh negara jepang anak sendari tk udah dibiasakan memilah sampah dan peduli lingkungan terus paham rambu rambu lalu lintas ini baru betul yang diajarkan,1
klub butut sama kayak fansnya yang merusak fasilitas umum padahal bukan di bandung,1
jangan sampai di bali tercemar ormas ga jelas yang hobinya ribut bli,0
judul esai lu aja udah pencemaran nama baik ajirrr,0
mirip sih tapi kenapa mereka harus ngerusak fasilitas umum juga ya,1
makanya caregiver tuh sangat perlu juga support tapi seringnya jadi samsak kesalahan diabaikan dan parahnya sih jadi bahan gosip udah lah capek malah dijadiin gosip kalo ada lingkungan suportif itu beruntung banget sih,0
mesti tiap akhir tahun banyak proyek gini udah tau musim ujan malah nambah macet aja,0
tak silap pernah baca buku pengalaman beliau salah satu nya beras bercampur dengan kaca ada yang azab nak air bagi air air pulak dah tercemar teruk,0
pastilaahhh jangankan kerjaan di lingkungan atau kondisi apapun pasti ada ajalah yang bikin emosi mah yang penting enjoy aja dinikmati aja,0
kasian orang yang daerahnya kekeringan kemarau panjang dikatain pecundang wkwkwk tolol bet,0
udah ga menaati peraturan merusak fasilitas umum bikin macet pula yang begini mending ga usah complaint tentang bobroknya negara deh soalnya kalian sediri adalah toping yang bikin negara makin bobrok,1
jadi teringat cerita ular dan manusia di hutan kalau jumpa keduanya matiin dulu manusia nya baru ularnya jangan terbalik nanti jadi masalah panjang wekawekaweka,0
pencemaran nama baik saya pikir lagi anda membahas sebuah berita yang pada saat itu tidak benar juga mengenai masalah shua dan agensi tidak confrim jadi otomatis pihak shua agensi juga melaporkan anda dong mba kan beliau semua juga dirugikan pencemaran nama baik,0
jika diibaratkan air laut banyaknya pernyataan beliau tapi tak satu tetespum tak tercemar,0
saya bangga kinerja bu risma bertanggung jawab moral dan fisik secara penuh semoga jadi gubernur bukan bangga dengan partainya tolong jalan rusak parah di wilayah surabaya barat saat bu risma jadi walikota pelaksana bidang tersebut tidak bertanggungjawab mungkin tidak lapor bu risma saat itu,1
happy weekend too meng semangat eventnya di hutan jangan lupa senyum juga ingyahhh,0
mas pram menghadiri diskusi publik biru talks menantang cagub jakarta selesaikan polusi udara memang bisa di norae coffee amp eatery tebet timur dalam acara ini ia menjawab pertanyaan masyarakat tentang tantangan dan solusi penyelesaian isu pencemaran udara di jakarta,0
pembangunan infrastruktur energi terbarukan memperkuat ketahanan energi dan mempromosikan upaya perlindungan lingkungan,0
analisa yang keliru yang benar lingkungan lah yang buat bisa jadi gay awal sekali kenapa bencong dibiarkan jadip psk banyak yang menyewa jasanya anak sama yang iseng godain mau di bj akhirnya menular ke banyak orang apalagi si x ini tidur bareng dengan lelaki bisa menularkan pnyakit ini,0
di press dong om suruh polisi seperti kasus vina cirebon,0
dia bukan pendakwah pliss ga semua orang yng bahas tentang agama di bilang pendakwah dong karena kasian jadi nama pendakwah yang sebenernya tercemar diaa emang problematic bjirrrr,0
bagi kami masyarakat yang sebagian besar bergantung pada lahan hutan untuk bercocok tanam penanaman pohon ini sangat berarti dan merupakan langkah nyata dalam mewujudkan ketahanan pangan sesuai arahan pemerintah tandasnya,0
haiiii ka liv yampyun gapapa deh jalanan macet asal ada yang jualan cangcimen ngasi air minum aman sentosa subeom para penyabar,0
meningkatkan fasilitas umum untuk kenyamanan masyarakat adalah langkah yang baik kebijakan kabinet merah putih,1
udara di indonesia semakin tercemar kita harus peduli sama lingkungan sekitar,1
baptis itu tradisi kaum zoroastrian inisiasi dengan air baptis membawa lidah api sehingga kalian mampu berbahasa roh gathas avesta dan kristen nyontek zoroaster majusi gitu,0
itu mantap tapi lebih mantap lagi jika bangun tambah pabrik pupuk,0
udah dewasa itu udah pada sunat cuma belum punya sim seharusnya polisi memudahkan siswa yang mau bikin sim bukan malah merazia enak bener seragam coklat merazia pengendara siswa yang gak punya sim sementara bikin sim dipersulit kalau gak ada duit ya gak lulus,0
untuk daerah karawang agak sulit soalnya macet jadi agak sulit untuk penis sampai tujuan,1
tanggung jawab kak aku mabok duchess terngiang ngiang terus waktu jake meluk heeseung pas baru sadar kalau dia udah bakar hutan aduuhhh kayak cimit gue suka banget scene itu gue juga mau begitu tellonym,0
cari kesibukan baru hobi baru dan reminder kalo dia adalah sampah xixixi,0
indonesia be like ngebangun fasilitas umum untuk masyarakat tidak bisa dilakukan tiada keuntungan diprivatisasi potong subsidi ngebangun gedung pemerintahan gas terus tapi meleset tidak sesuai dengan tujuan milyaran ga memberikan keuntungan sama sekali,1
rahma janjikan pembangunan fasilitas umum memadai demi kenyamanan masyarakat,1
merasa takut atau cemas anak kucing yang berada di lingkungan baru mungkin merasa cemas atau takut dan berperilaku hiperaktif,0
yang teen titans go itu mah sampah kesel banget liatnya,0
film dan musik kalian sampah sampai bulu pantat kau terbakar pun takan bisa tembus indonesia yang kalian produksi ini musik dan film sampah,0
kalo bisa milih juga gak pengin lagi ada di satu lingkungan yang sama,0
kamu kan cuma dari kosss aku dari rumah kena macet orang pada berangkat kerja sama sekolah,1
dan disambut hangat oleh kepala kantor wilayah bea cukai maluku yang diwakili oleh kepala bidang fasilitas kepabeanan dan cukai marilyn rhonda loupatty dan kepala bagian umum punjung raras dan tim,0
dalam menciptakan lingkungan yang aman tertib dan bebas dari penyalahgunaan narkoba kumhamsumsel lapasmuaraenim kumhampasti pemasyarakatan asnberakhlak muaraenim bersinar kemenimipas ditjenpas,0
kenapa horeg ini sistemnya keliling pakai truk kenapa nggak di lapangan terbuka saja jadi tidak merusak fasilitas umum dan rumah warga hiburan yang terlalu banyak merugikan ada yang joget sampai sehari semalam letak kebudayaannya di mana,1
seorang ayah memandikan putranya yang menderita penyakit kulit akibat tinggal di tendatenda dalam cuaca yang sangat panas air yang tercemar dan kurangnya obat obatan perawatan kulit sumber palinfo,0
kok tiang lampu ember sampah saja hilang rmhku ember sampah aku tali,0
c ada pusat pembinaan dan pelatihan olah raga bagi anak usia sd smp sma dan remaja umum fasilitas lapangan sepak bola lapangan volly lapangan footsal lapangan badminton lapangan tenis ruang meating ruang administrasi gudang alat medis,0
semoga seluruh rumah sakit dan fasilitas umum lainnya bisa menggunakan bahasa indonesia yaa,0
oiiii badut malaydesh apa kabar proses josh brownhill sampah asia tenggara,0
oecd juga memelopori berbagai standar global seperti prinsip polluter pays di bidang lingkungan yang mendorong agar pelaku pencemaran menanggung biaya dari dampak lingkungannya ini menunjukkan peran oecd sebagai penggerak inovasi dalam regulasi lingkungan dan mendukung,0
apa yang harus kami lakukan jika ada orang membuang sampah di sungai setiap hari,1
bro menurut gue ini harus dilarang wkwk merusak fasilitas umum bukannya ada hukumannya,1
razman arif ditetapkan tersangka pencemaran nama baik siap jalani proses hukum,0
jangan lelah berproses ingat kita seperti sampah disaat kita tidak punya apa apa comby one,0
kalau terganggu suara sound horeg hidup di hutan saja disini masyarakat butuh hiburan,0
wah kalo garis darah tercemar bolehkah maju half batak half jawa tapi aman abang bisa panggil kau hasian wanna be the next supernova carrd here rsvp or,0
tempat saya tinggal bau limbah bangkai untuk pakan ikan baunya bikin sesak nafas pusing mual vertigo monggo pihak dinas segera bertindak karena yang punya perikanan mengabaikan protes kami dan tidak mengubris omongan kami,1
cepat beliin aku obat buat kuping yang sudah tercemar ini,0
kamu kurang punya peran dan validasi di lingkungan kamu ya utututu retarded emg begitu sabar ya,0
sekelas ui sudah tercemar rezim biadab jahanam bangsat bengis laknat bajingan jancukkkkk,0
bahkan tweet gue ini aja dibully loh sama kawanan sampahnya hazel jangan temenan sama sampah makanya hazeeeel masa bully orang di normalisasi wakak jijik banget sumpah mana ga ada merasa bersalah hati nya sekeras itu dan gasadar karna dianggap normal,0
