complaint,is_complaint
utk konten beritanya agar lebih update lagi karena buat kami di bawah ini bisa jadi sebuah referensi atau rujukan informasi,0
tolong kasihani bas sm mia yg oksigennya tercemar karbon knalpot angkot caheum ciroyom,1
timsekop udah tercemar ganti jadi timtobat atau sekopers deh maxwell,0
timeline yang tercemar ini perlu pendinginan semangat beraktivitas ikutan kak ren ngademintl,0
sok tau banget lu kayak yg tau kondisinya cenayang emang lu ga usah mengarang kronologi di otak lu sendiri opini sampah,0
selain rasa sakit yang luar biasa otot otot kakinya benar benar sudah tegang akibat cedera amar bersandar pada salah satu pohon sambil meringis dari kejauhan ia bisa melihat obor senter dan lampu motor yang berjalan menyisir hutan yang berasal dari para warga jorong tengah,0
kantor pemerintah kota yang lokasinya berdekatan dengan sungai martapura dengan front office yg kekinian dan pelayanan yang ramah,0
mungkin otakku agak lemot tapi aku awalnya mikir ceritanya bakal tentang perusahaan yang kirim robot ke alam liar untuk mempelajari perilaku hewan ternyata ceritanya tentang robot yang tersesat karena pesawat delivery mereka jatuh di hutan,0
jangankan hutan kota gw lagi lari di inner ring road aja kena asep vape,1
genti aja ini namanya jadi kementerian sanitasi kerjaannya nyebokin anak orang doang,0
kemenperin buka suara terkait rencana pembangunan pabrik apple di indonesia tawarkan tiga syarat,0
dan sanitasi di pondoknya yg ga bagus bahkan santri pernah dipulangkan ke rumah krna pipa yg ngalir ke bak tinja itu bocor waktu itu sempet susah air dan karna lama dibenerin jadinya pada disuruh pulang belum lagi cerita kalo makanan dia sering diambil sama santri lain,1
emang udh ga sehat ini lingkungan sebenernya cuma gua gatau aja ini jdnya survey ke rumah barunya kapan gua udh mulai muak bgt disini asli,0
bisnis depot air minum dam isi ulang terus tumbuh seiring dengan kebutuhan masyarakat mengonsumsi air bersih,0
baru aja selesai baca beberapa hari lalu hidup gepeng green flag ijo neon hutan amazon semuanya dah lah,0
hidup di lingkungan yang suka ngejudge tapi ketika mau berproses malah ga didukung,0
tahniah datuk mokhzani ismail pengarah bahagian perkhidmatan muzik atas pengiktirafan terbaharu yang diterima semoga terus menyumbang bakti kepada kemajuan industri muzik tanah air syabas,0
program balai rakyat disambut antusias oleh masyarakat jakarta selain tidak menggangu fasilitas umum balai rakyat jg akan menghemat anggaran saat warga punya hajatan mantab jakartamenyala prakaruntukjakarta,0
memberi manfaat kepada semua orang sekecil apapun yang bisa saya lakukan untuk kelangsungan hidup sekarang dan masa depan dengan mengedukasi lewat seni kreasi daur ulang di chanel sutrisno art galery saya bangga dan bisa berkontribusi yang terbaik untuk semua masyarakat semoga chanel kami berkembang lebih baik dan bermanfaat,0
gua lebih ke yg b anying asli yg penting lingkungan kerja sama jobdeks yg jelas,0
polisi amsterdam diperiksa karena pakai kekerasan hadapi demonstran propalestina,0
sebagai anak perantauan dari remaja ketemu lingkungan kaya gini smwsampe nikah ikud suami ketemunya begini lg aku g menutup mata ada banyak org tua yg g sanggup menjalankan perannyahal spt ini jd semacam turun temurun yg dipaksakan oleh generasi sebelumnya,0
turut berduka cita utk semua korban yg bikin macet di jalan tol itu biasanya karena ada pintu tol di tengah jalan aspaan dah gunanya nyimpen pintu tol di tengah jalan selain bikin macet amp malak,0
mending iran nembakin missile isi eek dah biar israel kena black death sama kaya black death di prancis gegara sanitasi yang jorok,0
mana ada orang sakit tanpa penyebab aneh ngatain gua ngeyel padahal ga akan ada asap kalo ga ada api bodoamat mau lu tante gua juga bodoamat manusia aneh,0
kuda cuki mau balik malah ujan bangsat cape bener berangkat kena macet balik kejebak ujan pantek,0
emang netizen netizen sdm rendah dikasih ginian langsung kepanasan ya wajar lah ngomong udah sembuh orang pas kemaren pada ngereview rumputnya pada bagus pas sebelum jepang dateng emang kualitas rumputnya aja yg sampah sekali dipake latihan langsung hancur,0
klo keganggu sama org kristen lg berdoa ya hidup di hutan aja lu pikir di negara ini cuma islam doang toh yg keganggu sama adzan rata org islam juga,0
ketersediaan infrastruktur dasar seperti rumah layak huni air minum dan sanitasi sangat penting untuk meningkatkan taraf hidup masyarakat sigapmembangunnegeri,0
damn dulu pernah lihat gajah lewat dengan mata kepala sendiri waktu camping ke hutan pas sd gua auto uwaaaaawwww gajaaahh,0
lu pernah hidup di daerah yg kekeringan gak kaya dunia berputar di kehidupan orang yg tinggal di bantarak kali aja,0
bbbbbbbbbbbbbbbbbb kerja di lingkungan toxic bikin capekkkk bgt asliiii,0
bener banget kadang ak suka mikir apa sih susahnya buang sampah ga ditinggal di laci atau taruh dipojok kelas,1
problem utamanya berarti vandalisme kaya gabisa banget liat fasilitas umum yang bagus kudu banget dirusak,1
pak prof apakah seseorang di tersangkakan oleh aparat hukum tanpa ada pegangngan barang bukti di bolehkan secara hukum oleh kejagung menetapkan tl sebagai tersangka mungkinkah mereka tanpa barang bukti menurut saya nama kejagung akan tercemar bila mereka ceroboh,0
bukan membela sihakan tetapi siapa sih yang mau dihina apalagi sudah menjabat sebagai wakil presiden semoga tidak tersinggung dan melapor atas pencemaran nama baik bisa repot salam damai,0
adukan balik oknum yg melakukan pencemaran nama baiklihat video putrakelanabadminton tiktok,0
iyaaap sensitif di sini bukan perasaaannya ya eyin tapi dia suka menyerap zatzat buruk di air gitu jadi kalau air lautnya tercemar dia salah satu yang paling mudah mati,0
nyata banget emang merasa suci tapi aliran sungai penuh sampah nah itu depan mata hidup bisa berdampingan dgn sampah sungguh mengerikan,1
gbisa di story utama aja udah tercemar sebegitunya otakku,0
tujuannya adalah untuk memastikan bahwa bahwa seluruh proses pendidikan di lingkungan ui berlangsung sesuai dengan ketentuan yang telah ditetapkan,0
udah gw viralin skla kecil malah dia galak bawa tim legal ngancem gw pencemaran nama baik,0
filmthe wild robot mengusung genre scifi dengan latar hutan liar yang penuh tantangan,0
gugat balik aja dengan pasal pencemaran nama baik semua pasti banyak yg mendukung,0
biasanya itu kudu rombak ulang dan pake struktur kayu rentan rayap nah biaya buang brangkal dan limbah konstruksi sama renov nya itu yg muahall wkwk,0
lha situ juga kena pencemaran nama baik dong kan itu berita gak bener gimana dong cia,0
bahaya jika limbah amp sampah dibuang ke kali sungai di wilayah kota bekasi,1
bilang bahwa gw ngutang dan hal itu gak bener ya pencemaran nama baik yang elu jelasin itu doxxing belajar lagi,0
pagipagi udah stress ngentooooot website kkn ampas kampus sampah ngentot,0
ketua dpp partai nasdem yang juga anggota komisi x dpr ri ratih megasari singkarru mengatakan demi meningkatkan perhatian pada kualitas sanitasi sekolah yang menjadi elemen dasar dalam rangkaian upaya mencerdaskan kehidupan bangsa dpp partai nasdem meluncurkan program sanitasi,0
waktu tinggal d eropa ngeliat keluarga bisa ajak main anak di tempat umum museum dgn gratis amp aman menarik banget dan berencana seperti itu jg setelah berkeluarga amp hidup d indonesia ternyata beda yah ga bisa seleluasa itu amp ga gratis untuk mendapat fasilitas main yg baik,0
seni bisa menjadi segalanya di hidup seseorang tapi di sisi lain seni bisa dianggap sampah oleh orang lain muse on fame,0
kenampakan hujan meteor orionids tahun ini sedikit terganggu oleh cahaya bulan yg berada dalam fasa selepas purnama namun begitu kita masih berpeluang menyaksikan fenomena ini dgn menggunakan mata kasar dari lokasi yg gelap amp bebas drpd pencemaran cahaya sekiranya cuaca baik,0
woiilahhh ternyata bener lakilaki mah temennya semua semua yang mau temenan sama dia di jabanin kak itu si abken pelihara makhluk beku juga aku ambil dari pengalaman bbrp temen cowo ku kayak plis cowo di lempar ke hutan jg punya temen,0
pak kenapa e coli dijadikan indikator utama kalau air itu tercemar,0
kalo ada pasangan gay di lingkungan kalian tolong lah jangan dikucilkan ajak mereka liburan biar mereka senang kan mereka manusia juga misal ajak mereka mendaki gunung jika ada kesempatan dorong aja mereka berdua ke jurang ntar kalian harus kompak bilang kalo kecelakaan,0
proses penerimaan penyimpanan dan penanganan program pembersihan dan sanitasi sampai dengan sistem ketertelusuran dan penarikan pangan,0
udah mikir lama tapi endingnya malah ambil air mineral,0
demi allah wkwkwk ini desa samping rumah gue fyi guys emg ni kecamatan perbatasan gitu antara wonogiri dan sukoharjo terus dia itu emg masih banyak hutan alas gitu adem kok cmn ada bbrp kelurahan yg minim org tinggal kaya area tsb,0
jelas haus kasih sayang wong baru putus yang biasanya ada yang nyiram ini engga lalu apa salahnya kalau dia jadi haus dan kekeringan either fwaan atau trialan keduanya samasama tipe hubungan untuk mencari distraksi aja bukan,0
semuanya alasan sampah boleh tak hidup terus terang tak suka cakap tak suka takyah belit belit takyah tarik tali kita ni bukan dalam acara sukaneka anjing,0
pembangunan fasilitas sanitasi membuat lingkungan lebih bersih dan sehat,1
sama sejak banyak buzzer politik isinya sampah semua,0
bentar bentar berarti emang chloe gak ngomong itu pencemaran nih,0
ada orang yg pinter recycle sampah ada yg gk bisa ada orang yg pinter ngolah limbah ada yg gk bisa,0
pecat aja polisi arogan gitu malu maluin institusi saja kasihan polisi yang lain yang kemungkinan masih baik jadi ikut tercemar gara gara orang ini,0
pelayanan gatur pagi ditempat rawan macet dan laka lantas baik perkantoran maupun sekolah diwilkum polsek lohbener,0
kawal sampe kebongkar semua rugi sudah sampe sini nama pak tom juga jadi tercemar,0
itu klo ada yg nyanyi gitu pemain nonton apa ga si atau lgsg pulang setelah nyanyi tnh air ku,0
pengalaman sndiri ttg wisata domestik waktu mudik ke padang krn mudik perdana jd alhamdulillah menjelajah bbrp daerah di sumbar smpe alahan panjang tp ya itu capek dijalan ditambah kdg sedih dgn kondisi jalan utama yg kecil dan rusak transum jg susah,1
belajar tentang fungsi hutan kota bangunan ramah lingkungan amp keanekaragaman hayati,0
walaupun air mata gue mengalir dari pagi gue tetep beresin kos dan nugas wow aku udah menjadi wanita dewasa,0
iyaa loh kek biasa kekeringan terus di kasih minum sampe banjir bohong bgt klo ga nungguin sih wkwk untung kmu ga ngereog dijalan sih kata ku,0
karena tol itu rawan berdempet-dempetan apalagi kalau macet mereka gak jaga jarak coba kalau kendaraan jaga jarak ya aman,0
plus ketua yg ngasih lo arahan mana peduli sama keselamatan lo kalo misalnya dilaporin as pencemaran nama baik atau uu ite minimal kalo terima endors otaknya dipake dikit pahami dulu briefnya dan efek ke depannya kek gimana,0
berdayaan masyarakat dan pelestarian lingkungan perhutani adakan penanaman dengan kita bisa dan tugu insurance,0
ya terus abangnya setuju sama kampanye palm oil free gitu trus pengen beralih ke vegetable oil yg lahannya aja ga bisa jadi habitat satwa liar untuk hidup sawit itu tumbuhan hutan yg bisa jadi habitat satwa babi hutan monyet harimau dll lahan bunga matahari bisa apa,1
abis ini mam enak minum air putih jangan lupa mandi berendam air hangat terus bobo yaaa selamat istirahat,0
susah disuruh kekantor polisi aja kaga mau kan lo gua sih malu ya sampe sana lo yang kena hukum pencemaran nama baik polisi jg pasti cek hp gua detail dan gk nemu transaksi maupun chat begitu di gua,0
semoga tidak ada korban jiwa dan fasilitas umum serta harta warga sekitar yg ikut terbakar serta mengalami kerugian klo sound nya aja yg kebakar semoga berkelanjutan,1
paling sebel kalo lagi macet orang pada klakson klakson kayak ini kan macet lampu merah ya lu mau klakson sejuta kali juga kaga jalan orang belum ijo lampunya kalo mau cepet mah naik anjing aje naik anjing bang,1
aksiaksi sepihak dilancarkan oleh pki dan underbouwnya menambah kesemrawutan dalam pengelolaan negara setiap orang yang menentang perbuatan keji pki langsung dituding sebagai setan kota setan desa antek nekolim dsb,0
genderuwo harusnya buat laporan karna udah pencemaran nama baik,0
ya gimana ya apa yg mau diharapkan selain cuma gimmick dan pencitraan dari toko sebelah,0
lapas pasuruan tingkatkan sanitasi untuk dapur lapas dinkes kota pasuruan sudah sesuai prosedur info selengkapnya bisa di cek pada akun kami kemenkumhamri yasonnalaoly kemenkumhamjatim kakanwilkemenkumhamjatim heniyuwono,0
yang seharusnya dibenahi pengadaan pemerintah agar tidak dikenakan pajak efek penghematan anggaran transparansi data realisasi pendapatan jadi gak tercemar oleh aktivitas kantong kanan masuk kantong kiri prnya ya nanti tinggal di bagian membuktikan realisasi exemption,1
siang siang beli air kelapa belinya di mangga dua ini admin yang satu kenapa ini pantunnya sudah ada,0
sigurd terdiam sejenak sambil memandangi ponselnya rasanya ingin membenturkan kepalanya ke suatu tempat tapi nanti merusak fasilitas umum oh iya setidaknya membalas beberapa pesan dulu text to ezekiel iya nanti aku beritahu sampai jumpa lagi,0
demi allah gara gara lu nama wonu tercemar anyinggg hapus gak,0
gaada asap gaada api tuh kalimat yang lucu banget brengsek,0
ya ngga tau aku entah dia hidup dimana juga bisa jadi di hutan wkwkw,0
baca baca tadi katanya truk yang bawa limbah kardus rem blong,0
lingkungan pertemanan itu penting banget dalam berprilaku baik,0
soremau tanya kalau untuk sekolah vokasi pengelolaan hutan itu magangnya memang harus di luar pulau jawa terimakasih,0
ga perlu dijawab jg dan ga perlu msk ke radar kan tu cewek dibilang ga cari diatasnya tp emg dia asap bilang cari yg setara hanya ga mau turun dgn bawa bawa penghasilan emang brp besar rasio nemuin setara drpd diatasnya adabnya setara akhlaknya gmn atau semua perihal uang,0
toilet yang aman dan mudah diakses memberikan harapan baru bagi anakanak penyandang disabilitas di flores timur inisiatif sanitasi ramah disabilitas membantu anakanak seperti febi dan chafanno mendapatkan akses toilet yang aman di rumah mereka baca untuk setiap anak,1
pemkot magelang gelar lelang csr untuk wujudkan sanitasi aman masyarakat,0
fans malaysia tidak bercerita tapi siram air keras,0
video penampakan jalan rusak di salah satu desa di kabtrenggalek gimana nih min,0
jadi makin salut deh sama freeport indonesia yang terus berinovasi dan tetap bertanggung jawab terhadap lingkungan dan masyarakat sekitar,0
pantes nih akun udh tercemar muka blio org dipanggilin sm cwenya,0
dipukuli polisi dilaporkan oleh polisi diperiksa oleh polisi dijadikan tersangka oleh polisi,0
wah ini sih kalo ga terbukti bersalah negara harus ganti rugi dan gantian jaksa nya jadi tersangka pencemaran nama baik,0
bukan maen aqua di nobatkan paling banyak saat ini terkait sampah perusahaan nya gak peduli akan pencemaran lingkungan,1
kemungkinan besar batterynya menggembung gitu trus akhirnya bocor krn gakuat nampung cairannya battery failure bisa ggr kerusakan pabrik ato emg dicharge keseringan tp ini keknya kerusakan pabrik deh wkwkwk,0
pohon pohon di hutan semakin berkurang mari kita selalu dukung keberlanjutan lingkungan,1
sanitasi layak bakal diperhatikan biar masyarakat desa hidup lebih sehat dukung industri indonesia,1
aku takut suf kalau ternyata aku bakal di lingkungan ini teruss aku mau kok cegil kaya aku biasa caper sama mu kaya bener bener chat gitu tapi aku gamau,0
im one of the lucky teacher yang bisa dapat gaji yang layak dan beban kerja manusiawi lingkungan oke semoga rekanrekan pendidik bisa dapetin hal yang sama,0
iya nder coba deh ke hutan sapa tahu dikejar mereka kemarin gue dikejar irene,0
wadah aspirasi sgl mcm yg bersangkutan dg lingk hidup bg masyarakat jombang demi tercipta terpelihara jombang yg bersih indah aman nyaman,0
ya ampun lihat betapa rusaknya alam oleh pencemaran limbah tambang ini orang mau mengeruk semua sampai habis semua sda nyarakyat dikasih ampas limbah mereka brengsek emang pakai bahasa hilirisasi utk memoles kelakuan brengsek padahal asli mereka perusak alam,1
gabisa duaduanya ternyata bjirr sampe akhir tahun msh dikirim ke hutan aja,0
kalau benci karena dampaknya misal banjir ya harusnya bukan benci hujan tapi benci orang yg buang sampah sembarangan pemerintah yg kurang membuat area resapan kalau masalah kehujanan ya kenapa gk bawa payung jas hujan dah tau musim hujan,1
di kuningan daerah linggarjati atau cigugur adem agak sepi tapi fasilitas umum lengkap,0
hal ini merupakan upaya bersama menjaga kelestarian hutan hutan di indonesia kementerian perhutanan kemhut dan tni sepakat membuat memorandum of understanding mou dalam menjaga hutan di indonesia,0
dia mau di jebak biar di penjara juga kayaknya pasti itu penyumbang bakalan minta dan teh novi laporkan balik pencemaran nama baik,0
dpmg banda aceh lokakarya rencana pengembangan sanitasi jangka menengah,0
pencemaran limbah batu bara di bandung walhi bukti lemah penegakan hukum lingkungan,1
orang pakai kaca mata retak apapun yang dilihat tampak buruk berbanding balik profesi pemulung begitu yakin dalam tumpukan sampah tak berguna bisa mengkais nilai nilai yg masih bermanfaat,0
pungut sampah usai kampanye akbar istri hendrik lewerissa jadi sorotan,0
karna tekanan kerja atau ga cocok sm lingkungan kerjanya its just your self need an adaptation let your self adapt,0
setuju banget sama bang jhon lbf tapi manusia kayak begitu ngak perlu di skolahin tingi tingi emang ahlak nya udah tercemar tidak tertolong,0
berdiskusi tentang kebersihan dki jakarta bersama kepala dinas tempatnya banyak truk sampah baru yang siap melayani dki jakarta,0
ga mau dibilang fomo tpi yaa gmn klo kya gni ajaa dibilang tidak terduga,0
tasekgelugor pengerusi jawatankuasa agroteknologi keterjaminan makanan dan pembangunan koperasi pulau pinang fahmi zainol berkata tindakan itu diambil sebagai usaha mengatasi masalah pencemaran di sungai kereh hingga menimbulkan bau kurang menyenangkan terhadap penduduk,0
cowo langkahutan pun kalah hijau sama dia mau yang kayak minho ya allah,0
sdh ga punya gagasan soal banjir dan macet muncul gagasan yg penting jd pembicaraan orang soal kebutuhan masyarakat yg utama ga dipikirin,0
rambut kamu cepat bau meski baru cuci tenang aja angeleve punya solusi lengkap buat kamu tipstips ini bisa bantu rambutmu tetap segar seharian mulai dari menjaga kebersihan hingga produk perawatan yang tepat yuk intip caranya di sini,0
lingkungan hidup bakal dijaga buat masa depan generasi mendatang gerakanlawanjudionline,0
pergaulan urang baa sih kok bisa kenal mutualan samo urangurang mode tu seleksi lagi lingkungan sosial lah yo,0
kalo sekitaran sumur itu deket septictank atau limbah pabrik biasanya mudah tercemar sama bakteri koliform fekal ataupun nonfekal yuk baiknya minum air minum yang memang claimnya untuk diminum mahal sedikit asal sehat gapapa karena prosesnya juga ga mudah,1
cantikcantik ngomongnya kolor untung bukan sempak ya yimin takutnya citra idol kamu bisa tercemar,0
hrus nya jika tidak terbukti bersalah bisa dilaporkan balik pencemaran nama baik dan minta kompensasi,0
gaada doxxing adanya pencemaran nama baik dan komunikasi antar mahasiswa yang nggak bagus,0
jadi inget jaman sma waktu ekstrakulikuler materi survival disuruh nyari yang bisa diminum tapi gak boleh keran dengan pdnya temanku nadah air ac di tengah hutan mana ada ac,0
kalo mood kamu cepet hancur karena sesuatu yg tidak sesuai sama keinginan kamu mending kamu hidup di hutan aja paling banter dijambak otan,0
mana kts mu yang di pondok rolag itu perlu pake patwal soalnya wonokromo macet,0
maju dan jayalah kab sidoarjo dalam menata kotanya menjadi lebih indah dan cantik lagi terlebih dari segi lingkungan hidup dan kebersihan yang harus terus ditingkatkan,1
kok bisa tni serang pemukiman warga kenapa gak sekarang kkb papua yg di hutan,0
proyek ini kapan selesainya menyebabkan macet ini di jalan sunda yg sebelah kiri baru selesai sekitar seminggu yang lalu amp ditutup hanya alakadarnya dg semen hari ini sudah digali lagi di sebelah kanannya kenapa ngga sekalian sih galinya,1
pelayanan bagus petugas sangat membantu untuk mencarikan waktu yg tepat utk meeting agar tdk bolak balik ke kantor tsb informasi dan syarat yg diberikan cukup jelas,1
lumayan jauh jaraknya dari rumah tadi kesana mau ngajuin penelitian gitu pelayanannya ramah dan ngasih informasi yang baik juga cuma itu aja sih karena cepet juga cuma sekedar nanya pengajuan penelitian,0
mudah untuk mendapatkan informasi baik lewat media maupun langsung datang ke kantor petugas pelayanan pelayanan cekatan pelayanannya ramah dan cepat semoga kedepannya semakin di tingkatkan untuk segi pelayanannya,1
satu tentara idf bundir sama dengan berkurang satu pencemaran udara dan lingkungan,0
plis dan mohon hancurkan manusia macam sampah yang sudah basah dan terinjakinjak ini atau mimin bisa hubungi saya dengan manusia macam ini agar buat kesepakatan di atas ring tinju,0
buat sebagian masyarakat lebih baik hujan daripada kekeringan,0
tolong segera ditindak merusak fasilitas umum apa tidak ada hukuman yg begini ini,0
kesel bgt baru berapa jam jalan sendal gw rusak taekk kenapa gk dari tadi kan bisa ganti anjir,0
sedih banget sih sebenernya kalau liat ini padahal dokter kan pekerjaan yg sangat mulia perpanjangan tangan tuhan istilahnya tapi sayang ada kasus yg proses pendidikannya harus tercemar dengan perilaku setan,0
ini salah pemerintah krn gak becus sounding sistem sanitasi pemilahan sampah yg baik dan benar,1
sibuk bener dia sumpah di hutan lagi latihan leher bentar lagi ntar di luar angkasa,0
udah banyak kok yg gini teman gue malah sdah lulus dan siap penetapan nip malah gagal krna prodinya beda padahal dari dikti yg rubah nomenklatur prodi ilmunya sama kesehatan lingkungan jadi sanitasi analis kesehatan jadi ahli teknologi lab medik,0
cegah radikalisme ini upaya pemkot surabaya dimulai dari lingkungan sekolah,0
aowkoawok ini percuma bgt gak sih kamer drop beginian wong orang sokor aja gak dipercaya sama kumpulab sekte sampah itu,0
wkwkkw nagi epep aduh husbu gue tercemar gem bokem,0
pantai juga gapapa as long as gue ga berada di lingkungan yg serba cepat,0
langkah nyata ciptakan rutan bersih halinar rutan kelas iib gresik bersama tnipolri dan bnn gresik menggelar razia gabungan untuk memberantas narkoba hp ilegal dan barang terlarang lainnya di lingkungan rutan,0
lo laporin aja gampang boyntar klu g terbukti lo ganti yg dijeblosin ke penjarapencemaran nama baikberani ngak lo oya spil dong ijazah megawati habibi atau spy boy klu tau,0
sungai rinting tercemar akibat sisa kebakaran kilang,1
lahan sdh dipakai taman oleh dki saya harus menghubungi cp siapa di dinas kehutanan dki utk kelanjutannya thx pak,1
menanam pohon merupakan investasi dengan biaya kecil namun mempunyai dampak yang besar di masa depan menanam pohon adalah investasi yang berkelanjutan dan memberikan manfaat yang sangat luas baik bagi manusia makhluk hidup lainnya maupun lingkungan,0
semoga aja malah dia yg kena pidana skalian wkwk pencemaran nama baik jg,0
pencemaran nama baik genderuwokalo sampek genderuwo menuntut bisa brape tu,0
halo sobat juristic tahukah kamu semakin banyak perusahaan berlombalomba menciptakan produk ecofriendly ini bukan sekadar tren tapi langkah nyata demi lingkungan yang lebih baik yuk tonton videonya untuk tahu kenapa hal ini terjadi ikuti terus update terbaru,0
saya juga percaya mereka sebenarnya lagi mancari bahan utama nuklir dan pesawat alien yg diduga disembunyikan di hutan sana,0
ok kembali ke setelan pabrik saatnya bobo kali ini beneran bobo,0
iyaa nih mamaku sering bgt mangga direndem pake air garem,0
asap mulai mengepul dari celah partisi kaca dan pintu entah darimana asal api berkobar jerit dan derap kaki tergesa saling bersahutan panik melanda satusatunya jalan keluar hanyalah dengan menuruni tangga darurat,0
coba tuntut perbuatan tidak menyenangkan sama pencemaran nama baik,0
di bumiayu berebes selatan trotoar pada rusak bahaya bagi pengguna jalan,1
kalau cerita sukasuka stiap komunitas perusahaan personal apapun itu namanya maka tempatnya hutan yg penghuninya binatang yg semaunya semuanya ada aturan bahkan elu makan amp ke kamar mandi aja ada aturannya kecuali kamu memang idup gak punya norma pahaaam mikiiir,0
zionis israhell mana mengakui mereka mereka hanya mengakui kaum mereka sendiri ras murni campuran aja nggk diakui apalagi nggk ada darah yahudi mereka hanya dipergunakan utk propaganda aja udah mencapai tujuan dibuang mereka kaya sampah,0
mending kontraktor atau tukang borongan tergantung tp mending kontraktor sih krn antara kontrakor amp customer ada ikatan perjanjian klo misal ada yg ga sesuai rancang bangun pas jadi ada yang keliru ntah pipa saluran sanitasi atau kelistrikan asal kontraktornya bener ya,0
padahal kalau diliat dari manapun kebanyakan rakyat pengennya transportasi umum tempat buat nongkrong fasilitas pendidikan dan kesehatan yg bagus ga ada deh keknya kepikiran tentang ikn wkwk,0
tugas wapres ada di ranah konsep mikirin tentang pendidikan kemajuan ekonomi tampa merusak lingkungan konflik papua dll bukan malah buat program gimick semata apalagi blusukan masuk goronggorong masuk terowongan bagi susu di sekolah bukan itu ke gini disanjungsanjung,0
ini kucing siapa kerjaannya berantakin tempat sampah gue mulu jangan sampe gue hak milik bawa balik ke jkt nih,0
wah gimana nih intansi terkait ini udah termasuk ngerusak fasilitas umum,1
ga kebayang ni serius lintasin sungai dengan sungai sungai di jkt tercemar itu wkwkwk tu sungai yg di bekasi aja dirancang mau mirip di korea aj ga jadi,0
wkwkwkwkwkkwwk lucuuuuuu walaupun emang sirkulasi udara sanitasi air sama pencahayaan matahari penting tapi respon temenmu lucu,0
ngga nyakitin jijik liatnya krna ga terbiasa ada di lingkungan tukang selingkuh atau player dan sejenisnya takut ketularan ih karma nya,0
